,ID,post_id,post_title,post_excerpt,post_content_filtered,post_content,post_name,post_parent,permalink,guid,terms,each_description,case_description,ad_copy_text,ItemId,ItemIdText,StoreLocationId,ProductName,BrandName,BrandNameClean,BrandNameLower,Description,FullText,Price,SalePrice,UPCs,SubCategoryName,CategoryName,DepartmentName,DisableOrdering,OnSale,Featured,StorageDescription,ProductSize,UnitOfMeasure,SellUnit,total_popularity,trending_popularity,ProductFacets,score,terms.brand
292,8423131820,59469,Crispy Chicken Teriyaki Entree,,"<p>Entree, Crispy Chicken Teriyaki, 18 Oz Box</p>","<p>Entree, Crispy Chicken Teriyaki, 18 Oz Box</p>",842313,0,https://gfsstore.com/products/842313/,https://gfsstore.com/products/842313/,[],,,"<p>Entree, Crispy Chicken Teriyaki, 18 Oz Box</p>","['8423131', '842313']",8423131|842313,182,Crispy Chicken Teriyaki Entree,InnovAsian,InnovAsian,innovasian,"Entree, Crispy Chicken Teriyaki, 18 Oz Box","Crispy Chicken Teriyaki Entree InnovAsian Frozen Meat & Seafood Entree, Crispy Chicken Teriyaki, 18 Oz Box",9.99,,"['400084231312', '695119120390']",STUFFED CHICKEN ENTREES,Frozen Meat & Seafood,Meat & Seafood,,,,Freezer,18,OZ,Box,9,9,[],,
293,8571621820,129614,Frenched Bone-in Pork Chop,,<p></p>,<p></p>,857162,0,https://gfsstore.com/products/857162/,https://gfsstore.com/products/857162/,[],,,<p></p>,"['8571620', '857162']",8571620|857162,182,Frenched Bone-in Pork Chop,,,,"<h4><span data-sheets-value=""{&quot;1&quot;:2,&quot;2&quot;:&quot;4 - 8oz Frenched chops\nLean and juicy, these flavorful chops are hand trimmed with the bone frenched for impressive presentation. These chops are sure to impress.&quot;}"" data-sheets-userf","Frenched Bone-in Pork Chop  Pork <h4><span data-sheets-value=""{&quot;1&quot;:2,&quot;2&quot;:&quot;4 - 8oz Frenched chops\nLean and juicy, these flavorful chops are hand trimmed with the bone frenched for impressive presentation. These chops are sure to impress.&quot;}"" data-sheets-userf",22.99,,['400085716207'],PORK/LAMB/VEAL/MISC - CUSTOM,Pork,Meat & Seafood,,,,Cooler,4,Package,EA,9,9,[],,
294,3153381820,16241,Cocktail Franks,,"<p>Franks, Beef/Pork/Turkey, Cocktail, Frozen, 3.33 Lb Bag</p>","<p>Franks, Beef/Pork/Turkey, Cocktail, Frozen, 3.33 Lb Bag</p>",315338,0,https://gfsstore.com/products/315338/,https://gfsstore.com/products/315338/,,,,"<p>Franks, Beef/Pork/Turkey, Cocktail, Frozen, 3.33 Lb Bag</p>","['3153381', '315338']",3153381|315338,182,Cocktail Franks,Gordon Choice,Gordon Choice,gordon choice,"Franks, Beef/Pork/Turkey, Cocktail, Frozen, 3.33 Lb Bag","Cocktail Franks Gordon Choice Bratwurst, Sausage, Hot Dogs & Franks Franks, Beef/Pork/Turkey, Cocktail, Frozen, 3.33 Lb Bag",17.49,,"['093901000682', '093901315335', '093901680006']",GFS FRANKS,"Bratwurst, Sausage, Hot Dogs & Franks",Meat & Seafood,,,,Freezer,5328,OZ,Bag,192,8,[],,"[{'term_id': 343, 'slug': 'gordon-choice', 'name': 'Gordon Choice', 'parent': 0, 'term_taxonomy_id': 343}]"
295,3191901820,186151,Italian Style Meatballs,,"<p>Meatballs, Italian Style, Cooked, 26 Oz Each</p>","<p>Meatballs, Italian Style, Cooked, 26 Oz Each</p>",319190,0,https://gfsstore.com/products/319190/,https://gfsstore.com/products/319190/,[],,,"<p>Meatballs, Italian Style, Cooked, 26 Oz Each</p>","['3191901', '319190']",3191901|319190,182,Italian Style Meatballs,Cooked Perfect,Cooked Perfect,cooked perfect,"Meatballs, Italian Style, Cooked, 26 Oz Each","Italian Style Meatballs Cooked Perfect Frozen Meat & Seafood Meatballs, Italian Style, Cooked, 26 Oz Each",8.99,,"['036669063124', '400031919010']",MEATBALLS,Frozen Meat & Seafood,Meat & Seafood,,,,Freezer,26,OZ,Each,153,8,[],,
296,3540771820,204550,Breaded Buffalo Chicken Breast Chunks,,"<p>Chicken, Breast, Chunks, Breaded, Buffalo, 24 Oz Bag</p>","<p>Chicken, Breast, Chunks, Breaded, Buffalo, 24 Oz Bag</p>",354077,0,https://gfsstore.com/products/354077/,https://gfsstore.com/products/354077/,[],,,"<p>Chicken, Breast, Chunks, Breaded, Buffalo, 24 Oz Bag</p>","['3540771', '354077']",3540771|354077,182,Breaded Buffalo Chicken Breast Chunks,Tyson,Tyson,tyson,"Chicken, Breast, Chunks, Breaded, Buffalo, 24 Oz Bag","Breaded Buffalo Chicken Breast Chunks Tyson Frozen Meat & Seafood Chicken, Breast, Chunks, Breaded, Buffalo, 24 Oz Bag",11.49,,"['023700014054', '400035407711']",CHIX BNLS WNGS/STRIPS/CHNKS WHOLE MUSCLE,Frozen Meat & Seafood,Meat & Seafood,,,,Freezer,24,OZ,Bag,83,8,[],,
297,3542561820,204559,Fully Cooked Breaded Popcorn Chicken,,"<p>Chicken, Popcorn, Breaded, Fully Cooked, 24 Oz Bag</p>","<p>Chicken, Popcorn, Breaded, Fully Cooked, 24 Oz Bag</p>",354256,0,https://gfsstore.com/products/354256/,https://gfsstore.com/products/354256/,[],,,"<p>Chicken, Popcorn, Breaded, Fully Cooked, 24 Oz Bag</p>","['3542561', '354256']",3542561|354256,182,Fully Cooked Breaded Popcorn Chicken,Tyson,Tyson,tyson,"Chicken, Popcorn, Breaded, Fully Cooked, 24 Oz Bag","Fully Cooked Breaded Popcorn Chicken Tyson Frozen Meat & Seafood Chicken, Popcorn, Breaded, Fully Cooked, 24 Oz Bag",10.99,,"['023700014153', '400035425616']",CHIX BNLS WNGS/STRIPS/CHNKS WHOLE MUSCLE,Frozen Meat & Seafood,Meat & Seafood,,,,Freezer,24,OZ,Bag,61,8,[],,
298,3116331820,156121,Original Wrapped Hamburgers,,"<p>Hamburger, Original, Wrapped, 6 Ct Package</p>","<p>Hamburger, Original, Wrapped, 6 Ct Package</p>",311633,0,https://gfsstore.com/products/311633/,https://gfsstore.com/products/311633/,[],,,"<p>Hamburger, Original, Wrapped, 6 Ct Package</p>","['3116331', '311633']",3116331|311633,182,Original Wrapped Hamburgers,White Castle,White Castle,white castle,"Hamburger, Original, Wrapped, 6 Ct Package","Original Wrapped Hamburgers White Castle Frozen Meat & Seafood Hamburger, Original, Wrapped, 6 Ct Package",5.99,,"['082988000067', '400031163314']",WRAP SANDWICHES & ENTREES,Frozen Meat & Seafood,Meat & Seafood,,,,Freezer,6,EA,Package,55,8,[],,
299,1424091820,137419,Sweet Hawaiian Roll'd Dog,,"<p>Franks, Classic, Hawaiian Bun, 4.45 Oz Package</p>","<p>Franks, Classic, Hawaiian Bun, 4.45 Oz Package</p>",142409,0,https://gfsstore.com/products/142409/,https://gfsstore.com/products/142409/,[],,,"<p>Franks, Classic, Hawaiian Bun, 4.45 Oz Package</p>","['1424091', '142409']",1424091|142409,182,Sweet Hawaiian Roll'd Dog,Chicago Deli,Chicago Deli,chicago deli,"Franks, Classic, Hawaiian Bun, 4.45 Oz Package","Sweet Hawaiian Roll'd Dog Chicago Deli Bratwurst, Sausage, Hot Dogs & Franks Franks, Classic, Hawaiian Bun, 4.45 Oz Package",3.29,,"['074582164245', '400014240919']",NAT'L BRAND FRANKS,"Bratwurst, Sausage, Hot Dogs & Franks",Meat & Seafood,,,,Cooler,4.45,OZ,Package,54,8,[],,
300,1817731820,40402,Breaded Chicken Cordon Bleu,,"<p>Chicken Breasts, Breaded, Stuffed Cordon Bleu, 4 Ounce, Raw, Frozen, 36 Per Case</p>","<p>Chicken Breasts, Breaded, Stuffed Cordon Bleu, 4 Ounce, Raw, Frozen, 36 Per Case</p>",181773,0,https://gfsstore.com/products/181773/,https://gfsstore.com/products/181773/,,,,"<p>Chicken Breasts, Breaded, Stuffed Cordon Bleu, 4 Ounce, Raw, Frozen, 36 Per Case</p>","['1817730', '181773']",1817730|181773,182,Breaded Chicken Cordon Bleu,Gordon Choice,Gordon Choice,gordon choice,"Chicken Breasts, Breaded, Stuffed Cordon Bleu, 4 Ounce, Raw, Frozen, 36 Per Case","Breaded Chicken Cordon Bleu Gordon Choice Frozen Meat & Seafood Chicken Breasts, Breaded, Stuffed Cordon Bleu, 4 Ounce, Raw, Frozen, 36 Per Case",58.99,,"['093901181770', '400000181776', '400018177303']",STUFFED CHICKEN ENTREES,Frozen Meat & Seafood,Meat & Seafood,,,,Freezer,36,Case,EA,46,8,[],,"[{'term_id': 43, 'slug': 'gfs', 'name': 'GFS', 'parent': 0, 'term_taxonomy_id': 43}]"
301,5097901820,48393,"Turkey Breakfast Sausage, Cooked",,"<p>Breakfast Sausage, Turkey, Patties, 1.4 Ounce, Cooked, Frozen, 12 Lb Package</p>","<p>Breakfast Sausage, Turkey, Patties, 1.4 Ounce, Cooked, Frozen, 12 Lb Package</p>",509790,0,https://gfsstore.com/products/509790/,https://gfsstore.com/products/509790/,[],,,"<p>Breakfast Sausage, Turkey, Patties, 1.4 Ounce, Cooked, Frozen, 12 Lb Package</p>","['5097900', '509790']",5097900|509790,182,"Turkey Breakfast Sausage, Cooked",Gordon Choice,Gordon Choice,gordon choice,"Breakfast Sausage, Turkey, Patties, 1.4 Ounce, Cooked, Frozen, 12 Lb Package","Turkey Breakfast Sausage, Cooked Gordon Choice Bacon & Breakfast Sausage Breakfast Sausage, Turkey, Patties, 1.4 Ounce, Cooked, Frozen, 12 Lb Package",59.99,,"['093901509796', '400050979002']",GFS BREAKFAST SAUSAGE PRECKD,Bacon & Breakfast Sausage,Meat & Seafood,,,,Freezer,137,Case,EA,36,8,[],,
302,7772041820,56956,Jammin' Jerk Shrimp,,"<p>Shrimp, Tail-On, Jammin&#8217; Jerk, Skillet Ready in Minutes, 8 Oz Box</p>","<p>Shrimp, Tail-On, Jammin' Jerk, Skillet Ready in Minutes, 8 Oz Box</p>",777204,0,https://gfsstore.com/products/777204/,https://gfsstore.com/products/777204/,[],,,"<p>Shrimp, Tail-On, Jammin' Jerk, Skillet Ready in Minutes, 8 Oz Box</p>","['7772041', '777204']",7772041|777204,182,Jammin' Jerk Shrimp,Margaritaville,Margaritaville,margaritaville,"Shrimp, Tail-On, Jammin' Jerk, Skillet Ready in Minutes, 8 Oz Box","Jammin' Jerk Shrimp Margaritaville Frozen Meat & Seafood Shrimp, Tail-On, Jammin' Jerk, Skillet Ready in Minutes, 8 Oz Box",7.99,,"['025753028217', '400077720410']",PEELED & DEVEINED SHRIMP,Frozen Meat & Seafood,Meat & Seafood,,,,Freezer,8,OZ,Box,36,8,"[{'facet_name': 'Preparation', 'facet_value': 'Raw', 'facet_term_id': 1237}]",,
303,4955811820,48054,Italian Sliced Roast Beef,,"<p>Beef, Sliced Italian-Style, with Au Jus, 12 Pound Beef 10 Pounds Gravy, Frozen in Separate Bags, 22 Lb Package</p>","<p>Beef, Sliced Italian-Style, with Au Jus, 12 Pound Beef 10 Pounds Gravy, Frozen in Separate Bags, 22 Lb Package</p>",495581,0,https://gfsstore.com/products/495581/,https://gfsstore.com/products/495581/,[],,,"<p>Beef, Sliced Italian-Style, with Au Jus, 12 Pound Beef 10 Pounds Gravy, Frozen in Separate Bags, 22 Lb Package</p>","['4955810', '495581']",4955810|495581,182,Italian Sliced Roast Beef,Fontanini,Fontanini,fontanini,"Beef, Sliced Italian-Style, with Au Jus, 12 Pound Beef 10 Pounds Gravy, Frozen in Separate Bags, 22 Lb Package","Italian Sliced Roast Beef Fontanini Frozen Meat & Seafood Beef, Sliced Italian-Style, with Au Jus, 12 Pound Beef 10 Pounds Gravy, Frozen in Separate Bags, 22 Lb Package",159.99,,"['039437091114', '039437911108', '039437911177', '400049558102']",BEEF CKD / RAW SECTIONED & FORMED,Frozen Meat & Seafood,Meat & Seafood,,,,Freezer,352,Case,OZ,28,8,[],,
304,3939961820,214132,Opaa Chicken Shawarma,,"<p>Entree, Chicken, Shawarma, 12 Oz Package</p>","<p>Entree, Chicken, Shawarma, 12 Oz Package</p>",393996,0,https://gfsstore.com/products/393996/,https://gfsstore.com/products/393996/,[],,,"<p>Entree, Chicken, Shawarma, 12 Oz Package</p>","['3939961', '393996']",3939961|393996,182,Opaa Chicken Shawarma,Opaa! Brand,Opaa! Brand,opaa! brand,"Entree, Chicken, Shawarma, 12 Oz Package","Opaa Chicken Shawarma Opaa! Brand Frozen Meat & Seafood Entree, Chicken, Shawarma, 12 Oz Package",7.99,,"['075365177612', '400039399616']",CHICKEN BREAST BNLS / SKLS / MARINATED,Frozen Meat & Seafood,Meat & Seafood,,,,Freezer,12,OZ,Package,26,8,[],,
305,7186711820,16836,Pork Spare Rib Tips,,"<p>Pork Sparerib Tips, Frozen, 10 Lb Bag</p>","<p>Pork Sparerib Tips, Frozen, 10 Lb Bag</p>",718671,0,https://gfsstore.com/products/718671/,https://gfsstore.com/products/718671/,,,,"<p>Pork Sparerib Tips, Frozen, 10 Lb Bag</p>","['7186710', '718671']",7186710|718671,182,Pork Spare Rib Tips,Big Shoulders,Big Shoulders,big shoulders,"Pork Sparerib Tips, Frozen, 10 Lb Bag","Pork Spare Rib Tips Big Shoulders Pork Pork Sparerib Tips, Frozen, 10 Lb Bag",18.49,,"['053691541864', '90053691541867']",PORK SPARERIBS,Pork,Meat & Seafood,,,,Freezer,160,Case,OZ,25,8,[],,"[{'term_id': 186, 'slug': 'big-shoulders', 'name': 'Big Shoulders', 'parent': 0, 'term_taxonomy_id': 186}]"
306,3721651820,212122,Plantbased Sausage Patties,,"<p>Plantbased, Patties, Sausage, 7.4 Oz Package</p>","<p>Plantbased, Patties, Sausage, 7.4 Oz Package</p>",372165,0,https://gfsstore.com/products/372165/,https://gfsstore.com/products/372165/,[],,,"<p>Plantbased, Patties, Sausage, 7.4 Oz Package</p>","['3721651', '372165']",3721651|372165,182,Plantbased Sausage Patties,Gardein,Gardein,gardein,"Plantbased, Patties, Sausage, 7.4 Oz Package","Plantbased Sausage Patties Gardein Meatless Alternatives Plantbased, Patties, Sausage, 7.4 Oz Package",5.99,4.99,"['400037216519', '842234002470']",VEGETARIAN PRODUCTS,Meatless Alternatives,Meat & Seafood,,1,,Freezer,7.4,OZ,Package,12,8,[],,
307,3937381820,218637,Cooked Beef Italian Meatballs,,"<p>Meatballs, Beef, Italian, Cooked, 2 Lb Package</p>","<p>Meatballs, Beef, Italian, Cooked, 2 Lb Package</p>",393738,0,https://gfsstore.com/products/393738/,https://gfsstore.com/products/393738/,[],,,"<p>Meatballs, Beef, Italian, Cooked, 2 Lb Package</p>","['3937381', '393738']",3937381|393738,182,Cooked Beef Italian Meatballs,44th Street,44th Street,44th street,"Meatballs, Beef, Italian, Cooked, 2 Lb Package","Cooked Beef Italian Meatballs 44th Street Frozen Meat & Seafood Meatballs, Beef, Italian, Cooked, 2 Lb Package",13.49,,"['400039373814', '776578963428']",MEATBALLS,Frozen Meat & Seafood,Meat & Seafood,,,,Freezer,32,OZ,Package,9,8,[],,
308,4269251820,219455,Grilled Beef Skewer,,"<p>Beef, Skewer, Grilled, 30 Ct Package</p>","<p>Beef, Skewer, Grilled, 30 Ct Package</p>",426925,0,https://gfsstore.com/products/426925/,https://gfsstore.com/products/426925/,[],,,"<p>Beef, Skewer, Grilled, 30 Ct Package</p>","['4269250', '426925']",4269250|426925,182,Grilled Beef Skewer,Expresco,Expresco,expresco,"Beef, Skewer, Grilled, 30 Ct Package","Grilled Beef Skewer Expresco Bratwurst, Sausage, Hot Dogs & Franks Beef, Skewer, Grilled, 30 Ct Package",59.99,,"['400042692506', '621588116855']",MISC. COOKED BEEF PRODUCTS,"Bratwurst, Sausage, Hot Dogs & Franks",Meat & Seafood,,,,Freezer,30,Case,EA,8,8,[],,
309,3179161820,186565,Plantbased Breaded Chicken Breast Fillets,,"<p>Plantbased Fillets, Chicken Breast, Breaded, 8 Oz Bag</p>","<p>Plantbased Fillets, Chicken Breast, Breaded, 8 Oz Bag</p>",317916,0,https://gfsstore.com/products/317916/,https://gfsstore.com/products/317916/,[],,,"<p>Plantbased Fillets, Chicken Breast, Breaded, 8 Oz Bag</p>","['3179161', '317916']",3179161|317916,182,Plantbased Breaded Chicken Breast Fillets,Skinny Butcher,Skinny Butcher,skinny butcher,"Plantbased Fillets, Chicken Breast, Breaded, 8 Oz Bag","Plantbased Breaded Chicken Breast Fillets Skinny Butcher Meatless Alternatives Plantbased Fillets, Chicken Breast, Breaded, 8 Oz Bag",4.99,,"['400031791616', '810067722049']",VEGETARIAN PRODUCTS,Meatless Alternatives,Meat & Seafood,,,,Freezer,8,OZ,Bag,65,7,[],,
310,3540691820,204549,"Bone-In Cooked Buffalo Chicken Wings, NAE",,"<p>Chicken, Wings, Bone In, Buffalo, Cooked, 22 Oz Bag</p>","<p>Chicken, Wings, Bone In, Buffalo, Cooked, 22 Oz Bag</p>",354069,0,https://gfsstore.com/products/354069/,https://gfsstore.com/products/354069/,[],,,"<p>Chicken, Wings, Bone In, Buffalo, Cooked, 22 Oz Bag</p>","['3540691', '354069']",3540691|354069,182,"Bone-In Cooked Buffalo Chicken Wings, NAE",Tyson,Tyson,tyson,"Chicken, Wings, Bone In, Buffalo, Cooked, 22 Oz Bag","Bone-In Cooked Buffalo Chicken Wings, NAE Tyson Frozen Meat & Seafood Chicken, Wings, Bone In, Buffalo, Cooked, 22 Oz Bag",13.99,,"['023700046536', '400035406912']",COOKED CHICKEN WINGS,Frozen Meat & Seafood,Meat & Seafood,,,,Freezer,22,OZ,Bag,60,7,[],,
311,2533751820,16127,Pacific Cod Loins,,"<p>Cod Loins, Pacific, Wild-Caught, Boneless Skinless, 3 Ounce, Raw, IQF, 10 Lb Package</p>","<p>Cod Loins, Pacific, Wild-Caught, Boneless Skinless, 3 Ounce, Raw, IQF, 10 Lb Package</p>",253375,0,https://gfsstore.com/products/253375/,https://gfsstore.com/products/253375/,,,,"<p>Cod Loins, Pacific, Wild-Caught, Boneless Skinless, 3 Ounce, Raw, IQF, 10 Lb Package</p>","['2533750', '253375']",2533750|253375,182,Pacific Cod Loins,Kitchen Essentials,Kitchen Essentials,kitchen essentials,"Cod Loins, Pacific, Wild-Caught, Boneless Skinless, 3 Ounce, Raw, IQF, 10 Lb Package","Pacific Cod Loins Kitchen Essentials Frozen Meat & Seafood Cod Loins, Pacific, Wild-Caught, Boneless Skinless, 3 Ounce, Raw, IQF, 10 Lb Package",64.99,,"['093901253378', '400025337509', '609408407338']",COD LOINS & NATURAL PORTIONS,Frozen Meat & Seafood,Meat & Seafood,,,,Freezer,53,Case,EA,49,7,[],,"[{'term_id': 48, 'slug': 'kitchen-essentials', 'name': 'Kitchen Essentials', 'parent': 0, 'term_taxonomy_id': 48}]"
312,1241021820,29029,Hot Dogs,,"<p>Franks, Chicken, Pork, Fresh, 16 Oz Package</p>","<p>Franks, Chicken, Pork, Fresh, 16 Oz Package</p>",124102,0,https://gfsstore.com/?post_type=product&#038;p=29029,https://gfsstore.com/?post_type=product&#038;p=29029,[],,,"<p>Franks, Chicken, Pork, Fresh, 16 Oz Package</p>","['1241021', '124102']",1241021|124102,182,Hot Dogs,Sugardale,Sugardale,sugardale,"Franks, Chicken, Pork, Fresh, 16 Oz Package","Hot Dogs Sugardale Bratwurst, Sausage, Hot Dogs & Franks Franks, Chicken, Pork, Fresh, 16 Oz Package",3.29,,"['073890001129', '400012410215']",NAT'L BRAND FRANKS,"Bratwurst, Sausage, Hot Dogs & Franks",Meat & Seafood,,,,Cooler,16,OZ,Package,46,7,[],,
313,8318141820,128092,Skinless Alaskan Cod,,"<p>Cod, Alaskan, Skinless, Frozen, 5 Oz Each</p>","<p>Cod, Alaskan, Skinless, Frozen, 5 Oz Each</p>",831814,0,https://gfsstore.com/products/831814/,https://gfsstore.com/products/831814/,[],,,"<p>Cod, Alaskan, Skinless, Frozen, 5 Oz Each</p>","['8318141', '831814']",8318141|831814,182,Skinless Alaskan Cod,Cannon,Cannon,cannon,"Cod, Alaskan, Skinless, Frozen, 5 Oz Each","Skinless Alaskan Cod Cannon Frozen Meat & Seafood Cod, Alaskan, Skinless, Frozen, 5 Oz Each",4.99,,"['400083181410', '766572800393']",COD LOINS & NATURAL PORTIONS,Frozen Meat & Seafood,Meat & Seafood,,,,Freezer,1,EA,Each,42,7,[],,
314,1521211820,39640,Boneless Skinless Grilled Chicken Breasts,,"<p>Chicken Breasts, Boneless Skinless, Grilled, 3 Ounce, Select Cut, Cooked, Frozen, 5 Lb Bag, 2 Per Case</p>","<p>Chicken Breasts, Boneless Skinless, Grilled, 3 Ounce, Select Cut, Cooked, Frozen, 5 Lb Bag, 2 Per Case</p>",152121,0,https://gfsstore.com/products/152121/,https://gfsstore.com/products/152121/,[],,,"<p>Chicken Breasts, Boneless Skinless, Grilled, 3 Ounce, Select Cut, Cooked, Frozen, 5 Lb Bag, 2 Per Case</p>","['1521210', '152121']",1521210|152121,182,Boneless Skinless Grilled Chicken Breasts,Tyson Preferred Partner,Tyson Preferred Partner,tyson preferred partner,"Chicken Breasts, Boneless Skinless, Grilled, 3 Ounce, Select Cut, Cooked, Frozen, 5 Lb Bag, 2 Per Case","Boneless Skinless Grilled Chicken Breasts Tyson Preferred Partner Frozen Meat & Seafood Chicken Breasts, Boneless Skinless, Grilled, 3 Ounce, Select Cut, Cooked, Frozen, 5 Lb Bag, 2 Per Case",73.99,,"['023700025500', '023766915500', '400015212106']",COOKED CHICKEN BREASTS,Frozen Meat & Seafood,Meat & Seafood,,,,Freezer,54,Case,EA,27,7,[],,
315,3939971820,214133,Opaa El Pastor,,"<p>Entree, El Pastor, Marinated, Carved Slices, Pre-Cooked, No Preservatives, 12 Oz Package</p>","<p>Entree, El Pastor, Marinated, Carved Slices, Pre-Cooked, No Preservatives, 12 Oz Package</p>",393997,0,https://gfsstore.com/products/393997/,https://gfsstore.com/products/393997/,[],,,"<p>Entree, El Pastor, Marinated, Carved Slices, Pre-Cooked, No Preservatives, 12 Oz Package</p>","['3939971', '393997']",3939971|393997,182,Opaa El Pastor,Opaa! Brand,Opaa! Brand,opaa! brand,"Entree, El Pastor, Marinated, Carved Slices, Pre-Cooked, No Preservatives, 12 Oz Package","Opaa El Pastor Opaa! Brand Frozen Meat & Seafood Entree, El Pastor, Marinated, Carved Slices, Pre-Cooked, No Preservatives, 12 Oz Package",7.99,,"['075365177599', '075365177636', '400039399715']",SLICED/SHAVED BEEF STEAK,Frozen Meat & Seafood,Meat & Seafood,,,,Freezer,12,OZ,Package,22,7,[],,
316,3936791820,215456,Sausage Biscuit Buttermilk Sandwich,,"<p>Sandwich, Breakfast, Biscuit, Buttermilk, Sausage, 9.3 Oz Box</p>","<p>Sandwich, Breakfast, Biscuit, Buttermilk, Sausage, 9.3 Oz Box</p>",393679,0,https://gfsstore.com/products/393679/,https://gfsstore.com/products/393679/,[],,,"<p>Sandwich, Breakfast, Biscuit, Buttermilk, Sausage, 9.3 Oz Box</p>","['3936791', '393679']",3936791|393679,182,Sausage Biscuit Buttermilk Sandwich,Mason Dixie,Mason Dixie,mason dixie,"Sandwich, Breakfast, Biscuit, Buttermilk, Sausage, 9.3 Oz Box","Sausage Biscuit Buttermilk Sandwich Mason Dixie Frozen Meat & Seafood Sandwich, Breakfast, Biscuit, Buttermilk, Sausage, 9.3 Oz Box",5.79,,"['400039367912', '860005971602']",WRAP SANDWICHES & ENTREES,Frozen Meat & Seafood,Meat & Seafood,,,,Freezer,2,EA,Box,17,7,[],,
317,4273721820,219466,Southwestern Chicken Patties,,"<p>Chicken, Patties, Southwestern, 2 Lb Each</p>","<p>Chicken, Patties, Southwestern, 2 Lb Each</p>",427372,0,https://gfsstore.com/products/427372/,https://gfsstore.com/products/427372/,[],,,"<p>Chicken, Patties, Southwestern, 2 Lb Each</p>","['4273721', '427372']",4273721|427372,182,Southwestern Chicken Patties,,,,"Chicken, Patties, Southwestern, 2 Lb Each","Southwestern Chicken Patties  Frozen Meat & Seafood Chicken, Patties, Southwestern, 2 Lb Each",13.99,,"['041006055946', '400042737214']",RAW FROZEN CHICKEN,Frozen Meat & Seafood,Meat & Seafood,,,,Freezer,2,LB,Each,7,7,[],,
318,4273831820,219467,Hickory Smoked Beef Bacon,,"<p>Bacon, Beef, Hickory Smoked, 10 Oz Each</p>","<p>Bacon, Beef, Hickory Smoked, 10 Oz Each</p>",427383,0,https://gfsstore.com/products/427383/,https://gfsstore.com/products/427383/,[],,,"<p>Bacon, Beef, Hickory Smoked, 10 Oz Each</p>","['4273831', '427383']",4273831|427383,182,Hickory Smoked Beef Bacon,Devanco Foods,Devanco Foods,devanco foods,"Bacon, Beef, Hickory Smoked, 10 Oz Each","Hickory Smoked Beef Bacon Devanco Foods Bacon & Breakfast Sausage Bacon, Beef, Hickory Smoked, 10 Oz Each",7.79,,"['041006061893', '400042738310']",NAT'L BRAND BACON,Bacon & Breakfast Sausage,Meat & Seafood,,,,Freezer,10,OZ,Each,7,7,[],,
319,8571111820,129612,USDA Choice Top Sirloin Steak,,<p></p>,<p></p>,857111,0,https://gfsstore.com/products/857111/,https://gfsstore.com/products/857111/,[],,,<p></p>,"['8571110', '857111']",8571110|857111,182,USDA Choice Top Sirloin Steak,,,,"<p><span data-sheets-value=""{&quot;1&quot;:2,&quot;2&quot;:&quot;4 - 8oz Center Cut\nBold and meaty, perfect for grilling&quot;}"" data-sheets-userformat=""{&quot;2&quot;:641,&quot;3&quot;:[null,4,&quot;\&quot;$\&quot;#,##0&quot;,1],&quot;10&quot;:1,&quot;1","USDA Choice Top Sirloin Steak  Beef <p><span data-sheets-value=""{&quot;1&quot;:2,&quot;2&quot;:&quot;4 - 8oz Center Cut\nBold and meaty, perfect for grilling&quot;}"" data-sheets-userformat=""{&quot;2&quot;:641,&quot;3&quot;:[null,4,&quot;\&quot;$\&quot;#,##0&quot;,1],&quot;10&quot;:1,&quot;1",30.99,,['400085711103'],BEEF SIRLOINS PORTIONED - CUSTOM,Beef,Meat & Seafood,,,,Cooler,4,Package,EA,7,7,[],,
320,8572111820,129616,Angus Filet Mignon Tenderloin,,<p></p>,<p></p>,857211,0,https://gfsstore.com/products/857211/,https://gfsstore.com/products/857211/,[],,,<p></p>,"['8572110', '857211']",8572110|857211,182,Angus Filet Mignon Tenderloin,,,,"<h4><span data-sheets-value=""{&quot;1&quot;:2,&quot;2&quot;:&quot;4 - 8oz Hand trimmed Angus beef tenderloin\nButter tender and perfectly aged.&quot;}"" data-sheets-userformat=""{&quot;2&quot;:641,&quot;3&quot;:[null,4,&quot;\&quot;$\&quot;#,##0&quot;,1],&q","Angus Filet Mignon Tenderloin  Beef <h4><span data-sheets-value=""{&quot;1&quot;:2,&quot;2&quot;:&quot;4 - 8oz Hand trimmed Angus beef tenderloin\nButter tender and perfectly aged.&quot;}"" data-sheets-userformat=""{&quot;2&quot;:641,&quot;3&quot;:[null,4,&quot;\&quot;$\&quot;#,##0&quot;,1],&q",68.99,,['400085721102'],BEEF LOINS PORTIONED - CUSTOM,Beef,Meat & Seafood,,,,Cooler,4,Package,EA,7,7,[],,
321,8863721820,63895,Meat Lovers Vegan Burgers,,"<p>Burgers, Plant Based, Meat Lovers, Vegan, 16 Oz Bag</p>","<p>Burgers, Plant Based, Meat Lovers, Vegan, 16 Oz Bag</p>",886372,0,https://www.gfsstore.com/products/886372/,https://www.gfsstore.com/products/886372/,[],,,"<p>Burgers, Plant Based, Meat Lovers, Vegan, 16 Oz Bag</p>","['8863721', '886372']",8863721|886372,182,Meat Lovers Vegan Burgers,Morningstar Farms,Morningstar Farms,morningstar farms,"Burgers, Plant Based, Meat Lovers, Vegan, 16 Oz Bag","Meat Lovers Vegan Burgers Morningstar Farms Meatless Alternatives Burgers, Plant Based, Meat Lovers, Vegan, 16 Oz Bag",8.99,,"['028989102294', '400088637219']",VEGETARIAN PRODUCTS,Meatless Alternatives,Meat & Seafood,,,,Freezer,4,EA,Bag,7,7,[],,
322,7278121820,52924,Breakfast Sausage Links,,"<p>Breakfast Sausage, Pork, Links, Original, 12 Oz Package</p>","<p>Breakfast Sausage, Pork, Links, Original, 12 Oz Package</p>",727812,0,https://gfsstore.com/products/727812/,https://gfsstore.com/products/727812/,,,,"<p>Breakfast Sausage, Pork, Links, Original, 12 Oz Package</p>","['7278121', '727812']",7278121|727812,182,Breakfast Sausage Links,Smithfield,Smithfield,smithfield,"Breakfast Sausage, Pork, Links, Original, 12 Oz Package","Breakfast Sausage Links Smithfield Bacon & Breakfast Sausage Breakfast Sausage, Pork, Links, Original, 12 Oz Package",6.49,,"['070800276967', '400072781218']",BREAKFAST SAUSAGE NAT'L BRAND,Bacon & Breakfast Sausage,Meat & Seafood,,,,Cooler,12,OZ,Package,77,6,[],,"[{'term_id': 472, 'slug': 'smithfield', 'name': 'Smithfield', 'parent': 0, 'term_taxonomy_id': 472}]"
