,ID,post_id,post_title,post_excerpt,post_content_filtered,post_content,post_name,post_parent,permalink,guid,terms,each_description,case_description,ad_copy_text,ItemId,ItemIdText,StoreLocationId,ProductName,BrandName,BrandNameClean,BrandNameLower,Description,FullText,Price,SalePrice,UPCs,SubCategoryName,CategoryName,DepartmentName,DisableOrdering,OnSale,Featured,StorageDescription,ProductSize,UnitOfMeasure,SellUnit,total_popularity,trending_popularity,ProductFacets,score,terms.brand
173,8782081820,131676,All-Natural Chicken Sausages,,"<p>Sausage, Chicken, Pork, All-Natural, 3 Lb Bag</p>","<p>Sausage, Chicken, Pork, All-Natural, 3 Lb Bag</p>",878208,0,https://gfsstore.com/products/878208/,https://gfsstore.com/products/878208/,[],,,"<p>Sausage, Chicken, Pork, All-Natural, 3 Lb Bag</p>","['8782081', '878208']",8782081|878208,182,All-Natural Chicken Sausages,Jones Dairy Farm,Jones Dairy Farm,jones dairy farm,"Sausage, Chicken, Pork, All-Natural, 3 Lb Bag","All-Natural Chicken Sausages Jones Dairy Farm Bacon & Breakfast Sausage Sausage, Chicken, Pork, All-Natural, 3 Lb Bag",19.99,,"['033900075311', '400087820810']",BREAKFAST SAUSAGE NAT'L BRAND,Bacon & Breakfast Sausage,Meat & Seafood,,,,Freezer,48,OZ,Bag,31,31,[],,
174,3111581820,148353,"Spicy Breaded Chicken Breast Patties, Ready to Cook",,"<p>Chicken Breast, Patties, Breaded, Ready to Cook, Spicy, 5 Lb Bag</p>","<p>Chicken Breast, Patties, Breaded, Ready to Cook, Spicy, 5 Lb Bag</p>",311158,0,https://gfsstore.com/products/311158/,https://gfsstore.com/products/311158/,[],,,"<p>Chicken Breast, Patties, Breaded, Ready to Cook, Spicy, 5 Lb Bag</p>","['3111581', '311158']",3111581|311158,182,"Spicy Breaded Chicken Breast Patties, Ready to Cook",Club Pack,Club Pack,club pack,"Chicken Breast, Patties, Breaded, Ready to Cook, Spicy, 5 Lb Bag","Spicy Breaded Chicken Breast Patties, Ready to Cook Club Pack Frozen Meat & Seafood Chicken Breast, Patties, Breaded, Ready to Cook, Spicy, 5 Lb Bag",16.49,,"['400031115818', '694022516443', '6940225164436', '819316016595']",CHICKEN PATTIES,Frozen Meat & Seafood,Meat & Seafood,,,,Freezer,80,OZ,Bag,84,30,[],,
175,2703091820,146721,"EZ Peel Raw Shrimp, 21-25 count",,"<p>Shrimp, Raw, EZ Peel, 21-25 count, 2 Lb Bag</p>","<p>Shrimp, Raw, EZ Peel, 21-25 count, 2 Lb Bag</p>",270309,0,https://gfsstore.com/products/270309/,https://gfsstore.com/products/270309/,[],,,"<p>Shrimp, Raw, EZ Peel, 21-25 count, 2 Lb Bag</p>","['2703091', '270309']",2703091|270309,182,"EZ Peel Raw Shrimp, 21-25 count",Oishi,Oishi,oishi,"Shrimp, Raw, EZ Peel, 21-25 count, 2 Lb Bag","EZ Peel Raw Shrimp, 21-25 count Oishi Frozen Meat & Seafood Shrimp, Raw, EZ Peel, 21-25 count, 2 Lb Bag",17.99,,"['400027030910', '748734103849', '748734104129']",EZ PEEL SHRIMP,Frozen Meat & Seafood,Meat & Seafood,,,,Freezer,32,OZ,Bag,77,30,"[{'facet_name': 'Preparation', 'facet_value': 'Raw', 'facet_term_id': 1237}]",,
176,3937781820,219367,Cooked Angus Beef Patty,,"<p>Patties, Beef, Angus, Cooked, 2 Lb Package</p>","<p>Patties, Beef, Angus, Cooked, 2 Lb Package</p>",393778,0,https://gfsstore.com/products/393778/,https://gfsstore.com/products/393778/,[],,,"<p>Patties, Beef, Angus, Cooked, 2 Lb Package</p>","['3937781', '393778']",3937781|393778,182,Cooked Angus Beef Patty,44th Street,44th Street,44th street,"Patties, Beef, Angus, Cooked, 2 Lb Package","Cooked Angus Beef Patty 44th Street Frozen Meat & Seafood Patties, Beef, Angus, Cooked, 2 Lb Package",14.49,,"['400039377812', '776578963626']",COOKED BEEF PATTIES & MEATLOAF,Frozen Meat & Seafood,Meat & Seafood,,,,Freezer,32,OZ,Package,33,30,[],,
177,8621931820,17248,"Pollock Fillets, 4 - 6 oz.",,"<p>Pollock Fillets, Wild-Caught, Boneless Skinless, 4-6 Ounce, Raw, IQF, 10 Lb Box</p>","<p>Pollock Fillets, Wild-Caught, Boneless Skinless, 4-6 Ounce, Raw, IQF, 10 Lb Box</p>",862193,0,https://gfsstore.com/products/862193/,https://gfsstore.com/products/862193/,[],,,"<p>Pollock Fillets, Wild-Caught, Boneless Skinless, 4-6 Ounce, Raw, IQF, 10 Lb Box</p>","['8621931', '862193']",8621931|862193,182,"Pollock Fillets, 4 - 6 oz.",,,,"Pollock Fillets, Wild-Caught, Boneless Skinless, 4-6 Ounce, Raw, IQF, 10 Lb Box","Pollock Fillets, 4 - 6 oz.  Frozen Meat & Seafood Pollock Fillets, Wild-Caught, Boneless Skinless, 4-6 Ounce, Raw, IQF, 10 Lb Box",30.99,,"['061749136023', '400086219318', '895435001247']",POLLOCK FILLETS,Frozen Meat & Seafood,Meat & Seafood,,,,Freezer,32,EA,Box,30,30,[],,
178,8641421820,130233,Thick N Juicy Burgers,,"<p>Hamburgers, Thick N Easy, 2 Lb Package</p>","<p>Hamburgers, Thick N Easy, 2 Lb Package</p>",864142,0,https://gfsstore.com/products/864142/,https://gfsstore.com/products/864142/,[],,,"<p>Hamburgers, Thick N Easy, 2 Lb Package</p>","['8641421', '864142']",8641421|864142,182,Thick N Juicy Burgers,Holten Meats,Holten Meats,holten meats,"Hamburgers, Thick N Easy, 2 Lb Package","Thick N Juicy Burgers Holten Meats Frozen Meat & Seafood Hamburgers, Thick N Easy, 2 Lb Package",10.99,,"['079821000759', '400086414218']",SPECIALTY BEEF PATTIES,Frozen Meat & Seafood,Meat & Seafood,,,,Freezer,32,OZ,Package,30,30,[],,
179,2082241820,15987,Cream Cheese Stuffed Chicken Breast,,"<p>Chicken, Buffalo Stuffed, Cream Cheese, Raw, Individually Wrapped, 5 Oz Package</p>","<p>Chicken, Buffalo Stuffed, Cream Cheese, Raw, Individually Wrapped, 5 Oz Package</p>",208224,0,https://gfsstore.com/products/208224/,https://gfsstore.com/products/208224/,,,,"<p>Chicken, Buffalo Stuffed, Cream Cheese, Raw, Individually Wrapped, 5 Oz Package</p>","['2082241', '208224']",2082241|208224,182,Cream Cheese Stuffed Chicken Breast,Milford Valley,Milford Valley,milford valley,"Chicken, Buffalo Stuffed, Cream Cheese, Raw, Individually Wrapped, 5 Oz Package","Cream Cheese Stuffed Chicken Breast Milford Valley Frozen Meat & Seafood Chicken, Buffalo Stuffed, Cream Cheese, Raw, Individually Wrapped, 5 Oz Package",2.49,,"['073981333771', '400020822413']",STUFFED CHICKEN ENTREES,Frozen Meat & Seafood,Meat & Seafood,,,,Freezer,1,EA,Package,131,29,[],,"[{'term_id': 456, 'slug': 'milford-valley', 'name': 'Milford Valley', 'parent': 0, 'term_taxonomy_id': 456}]"
180,1444711820,39481,Sliced Italian-Style Beef,,"<p>Beef, Sliced Italian-Style, with Gravy, 8 Pounds Beef 8 Pounds Gravy, Frozen in Separate Bags, 16.6 Lb Bag</p>","<p>Beef, Sliced Italian-Style, with Gravy, 8 Pounds Beef 8 Pounds Gravy, Frozen in Separate Bags, 16.6 Lb Bag</p>",144471,0,https://gfsstore.com/products/144471/,https://gfsstore.com/products/144471/,[],,,"<p>Beef, Sliced Italian-Style, with Gravy, 8 Pounds Beef 8 Pounds Gravy, Frozen in Separate Bags, 16.6 Lb Bag</p>","['1444710', '144471']",1444710|144471,182,Sliced Italian-Style Beef,Allonco Inc.,Allonco Inc.,allonco inc.,"Beef, Sliced Italian-Style, with Gravy, 8 Pounds Beef 8 Pounds Gravy, Frozen in Separate Bags, 16.6 Lb Bag","Sliced Italian-Style Beef Allonco Inc. Frozen Meat & Seafood Beef, Sliced Italian-Style, with Gravy, 8 Pounds Beef 8 Pounds Gravy, Frozen in Separate Bags, 16.6 Lb Bag",59.99,,['400014447103'],BEEF CKD / RAW SECTIONED & FORMED,Frozen Meat & Seafood,Meat & Seafood,,,,Freezer,265.6,Case,OZ,117,29,[],,
181,2327261820,41959,Kielbasa,,"<p>Sausage, Kielbasa Beef &#038; Pork, 6-7/20 Inch, Links, Natural Casing, 4 Count Per Pound, Cooked, Frozen, 5 Lb Bag, 2 Per Case</p>","<p>Sausage, Kielbasa Beef & Pork, 6-7/20 Inch, Links, Natural Casing, 4 Count Per Pound, Cooked, Frozen, 5 Lb Bag, 2 Per Case</p>",232726,0,https://gfsstore.com/products/232726/,https://gfsstore.com/products/232726/,[],,,"<p>Sausage, Kielbasa Beef & Pork, 6-7/20 Inch, Links, Natural Casing, 4 Count Per Pound, Cooked, Frozen, 5 Lb Bag, 2 Per Case</p>","['2327260', '232726']",2327260|232726,182,Kielbasa,Gordon Choice,Gordon Choice,gordon choice,"Sausage, Kielbasa Beef & Pork, 6-7/20 Inch, Links, Natural Casing, 4 Count Per Pound, Cooked, Frozen, 5 Lb Bag, 2 Per Case","Kielbasa Gordon Choice Bratwurst, Sausage, Hot Dogs & Franks Sausage, Kielbasa Beef & Pork, 6-7/20 Inch, Links, Natural Casing, 4 Count Per Pound, Cooked, Frozen, 5 Lb Bag, 2 Per Case",36.99,,"['093901232724', '10093901232721', '400023272604']",GFS SPECIALTY SAUSAGES,"Bratwurst, Sausage, Hot Dogs & Franks",Meat & Seafood,,,,Freezer,40,Case,EA,93,29,[],,
182,3541161820,204551,"Dino Shaped Chicken Nuggets, FC NAE",,"<p>Chicken, Nuggets, Dino Shaped, Fully Cooked, 29 Oz Bag</p>","<p>Chicken, Nuggets, Dino Shaped, Fully Cooked, 29 Oz Bag</p>",354116,0,https://gfsstore.com/products/354116/,https://gfsstore.com/products/354116/,[],,,"<p>Chicken, Nuggets, Dino Shaped, Fully Cooked, 29 Oz Bag</p>","['3541161', '354116']",3541161|354116,182,"Dino Shaped Chicken Nuggets, FC NAE",Tyson,Tyson,tyson,"Chicken, Nuggets, Dino Shaped, Fully Cooked, 29 Oz Bag","Dino Shaped Chicken Nuggets, FC NAE Tyson Frozen Meat & Seafood Chicken, Nuggets, Dino Shaped, Fully Cooked, 29 Oz Bag",7.49,5.99,"['023700014528', '400035411619']",CHICKEN NUGGETS FORMED,Frozen Meat & Seafood,Meat & Seafood,,1,,Freezer,29,OZ,Bag,74,29,[],,
183,7775801820,53799,Swai Fillets,,"<p>Swai Fillets, Farm-Raised, Boneless, Skinless, 3-5 Ounce, Raw, Frozen, 15 Lb Bag</p>","<p>Swai Fillets, Farm-Raised, Boneless, Skinless, 3-5 Ounce, Raw, Frozen, 15 Lb Bag</p>",777580,0,https://gfsstore.com/products/777580/,https://gfsstore.com/products/777580/,[],,,"<p>Swai Fillets, Farm-Raised, Boneless, Skinless, 3-5 Ounce, Raw, Frozen, 15 Lb Bag</p>","['7775800', '777580']",7775800|777580,182,Swai Fillets,,,,"Swai Fillets, Farm-Raised, Boneless, Skinless, 3-5 Ounce, Raw, Frozen, 15 Lb Bag","Swai Fillets  Frozen Meat & Seafood Swai Fillets, Farm-Raised, Boneless, Skinless, 3-5 Ounce, Raw, Frozen, 15 Lb Bag",44.99,,['10061749132022'],FRESHWATER FISH FILLETS,Frozen Meat & Seafood,Meat & Seafood,,,,Freezer,240,Case,OZ,65,29,[],,
184,8716311820,36672,Applewood Smoked Layout Bacon,,"<p>Bacon, Laid Out, Applewood Smoked, 14-18 Count per Pound, Frozen, 15 Lb Package</p>","<p>Bacon, Laid Out, Applewood Smoked, 14-18 Count per Pound, Frozen, 15 Lb Package</p>",871631,0,https://gfsstore.com/?post_type=product&#038;p=36672,https://gfsstore.com/?post_type=product&#038;p=36672,[],,,"<p>Bacon, Laid Out, Applewood Smoked, 14-18 Count per Pound, Frozen, 15 Lb Package</p>","['8716310', '871631']",8716310|871631,182,Applewood Smoked Layout Bacon,Gordon Choice,Gordon Choice,gordon choice,"Bacon, Laid Out, Applewood Smoked, 14-18 Count per Pound, Frozen, 15 Lb Package","Applewood Smoked Layout Bacon Gordon Choice Bacon & Breakfast Sausage Bacon, Laid Out, Applewood Smoked, 14-18 Count per Pound, Frozen, 15 Lb Package",74.99,,['400087163108'],GFS BACON,Bacon & Breakfast Sausage,Meat & Seafood,,,,Freezer,240,Case,OZ,29,29,[],,
185,7731921820,123064,Fully Cooked Bacon,,"<p>Bacon, Sliced, Fully Cooked, 2.52 Oz Package</p>","<p>Bacon, Sliced, Fully Cooked, 2.52 Oz Package</p>",773192,0,https://gfsstore.com/products/773192/,https://gfsstore.com/products/773192/,[],,,"<p>Bacon, Sliced, Fully Cooked, 2.52 Oz Package</p>","['7731921', '773192']",7731921|773192,182,Fully Cooked Bacon,Hormel,Hormel,hormel,"Bacon, Sliced, Fully Cooked, 2.52 Oz Package","Fully Cooked Bacon Hormel Bacon & Breakfast Sausage Bacon, Sliced, Fully Cooked, 2.52 Oz Package",5.79,,"['037600160957', '400077319218']",BACON: PRE & FULLY COOKED,Bacon & Breakfast Sausage,Meat & Seafood,,,,Cooler,2.52,OZ,Package,163,28,[],,
186,3206991820,188358,Opaa Gyro Beef And Lamb Sndwch,,"<p>Sandwich, Gyro, Beef, Lamb, 7.35 Oz Each</p>","<p>Sandwich, Gyro, Beef, Lamb, 7.35 Oz Each</p>",320699,0,https://gfsstore.com/products/320699/,https://gfsstore.com/products/320699/,[],,,"<p>Sandwich, Gyro, Beef, Lamb, 7.35 Oz Each</p>","['3206991', '320699']",3206991|320699,182,Opaa Gyro Beef And Lamb Sndwch,Opaa,Opaa,opaa,"Sandwich, Gyro, Beef, Lamb, 7.35 Oz Each","Opaa Gyro Beef And Lamb Sndwch Opaa Beef Sandwich, Gyro, Beef, Lamb, 7.35 Oz Each",3.99,,"['075365060594', '400032069912']",LAMB CUTS,Beef,Meat & Seafood,,,,Freezer,7.35,OZ,Each,128,28,[],,
187,2371131820,20039,BBQ Pulled Pork,,"<p>Entree, Pulled Pork, Honey BBQ, 1 Lb Tray</p>","<p>Entree, Pulled Pork, Honey BBQ, 1 Lb Tray</p>",237113,0,https://gfsstore.com/?post_type=product&#038;p=20039,https://gfsstore.com/?post_type=product&#038;p=20039,,,,"<p>Entree, Pulled Pork, Honey BBQ, 1 Lb Tray</p>","['2371131', '237113']",2371131|237113,182,BBQ Pulled Pork,Jack Daniel's,Jack Daniel's,jack daniel's,"Entree, Pulled Pork, Honey BBQ, 1 Lb Tray","BBQ Pulled Pork Jack Daniel's Pork Entree, Pulled Pork, Honey BBQ, 1 Lb Tray",8.99,,"['400023711318', '895334001065']",PREPARED BBQ & CHILI,Pork,Meat & Seafood,,,,Cooler,16,OZ,Tray,115,28,[],,"[{'term_id': 530, 'slug': 'jack-daniels', 'name': ""Jack Daniel's"", 'parent': 0, 'term_taxonomy_id': 530}]"
188,7615411820,85696,Hot Italian Sausage Rope,,"<p>Sausage, Hot Italian, Rope, 3 Lb Package</p>","<p>Sausage, Hot Italian, Rope, 3 Lb Package</p>",761541,0,https://admin.gfsstore.com/?post_type=product&#038;p=85696,https://admin.gfsstore.com/?post_type=product&#038;p=85696,,,,"<p>Sausage, Hot Italian, Rope, 3 Lb Package</p>","['7615411', '761541']",7615411|761541,182,Hot Italian Sausage Rope,Randolph,Randolph,randolph,"Sausage, Hot Italian, Rope, 3 Lb Package","Hot Italian Sausage Rope Randolph Bratwurst, Sausage, Hot Dogs & Franks Sausage, Hot Italian, Rope, 3 Lb Package",11.99,10.99,"['400076154117', '769363920126']",SPECIALTY SAUSAGE NAT'L BRAND,"Bratwurst, Sausage, Hot Dogs & Franks",Meat & Seafood,,1,,Freezer,48,OZ,Package,113,28,[],,"[{'term_id': 801, 'slug': 'randolph', 'name': 'Randolph', 'parent': 0, 'term_taxonomy_id': 801}]"
189,2626921820,42742,Sirloin Cut Pork Chops,,"<p>Pork Loin Chops, Marinated, Bone-In, Sirloin-End Only, 4-1/2 Ounce, IQF, 10 Lb Bag</p>","<p>Pork Loin Chops, Marinated, Bone-In, Sirloin-End Only, 4-1/2 Ounce, IQF, 10 Lb Bag</p>",262692,0,https://gfsstore.com/products/262692/,https://gfsstore.com/products/262692/,[],,,"<p>Pork Loin Chops, Marinated, Bone-In, Sirloin-End Only, 4-1/2 Ounce, IQF, 10 Lb Bag</p>","['2626920', '262692']",2626920|262692,182,Sirloin Cut Pork Chops,Davis Creek Meats,Davis Creek Meats,davis creek meats,"Pork Loin Chops, Marinated, Bone-In, Sirloin-End Only, 4-1/2 Ounce, IQF, 10 Lb Bag","Sirloin Cut Pork Chops Davis Creek Meats Pork Pork Loin Chops, Marinated, Bone-In, Sirloin-End Only, 4-1/2 Ounce, IQF, 10 Lb Bag",43.99,,"['093901262691', '400026269205']",PORK CHOPS,Pork,Meat & Seafood,,,,Freezer,36,Case,EA,96,28,[],,
190,1634401820,39868,Whole Hog Breakfast Sausage,,"<p>Breakfast Sausage, Whole Hog, Patties, 4 Ounce, Raw, Frozen, 12 Lb Package</p>","<p>Breakfast Sausage, Whole Hog, Patties, 4 Ounce, Raw, Frozen, 12 Lb Package</p>",163440,0,https://gfsstore.com/products/163440/,https://gfsstore.com/products/163440/,[],,,"<p>Breakfast Sausage, Whole Hog, Patties, 4 Ounce, Raw, Frozen, 12 Lb Package</p>","['1634400', '163440']",1634400|163440,182,Whole Hog Breakfast Sausage,Gordon Choice,Gordon Choice,gordon choice,"Breakfast Sausage, Whole Hog, Patties, 4 Ounce, Raw, Frozen, 12 Lb Package","Whole Hog Breakfast Sausage Gordon Choice Bacon & Breakfast Sausage Breakfast Sausage, Whole Hog, Patties, 4 Ounce, Raw, Frozen, 12 Lb Package",46.99,,"['093901163448', '400016344004']",GFS WHOLE HOG BREAKFAST SAUSAGE,Bacon & Breakfast Sausage,Meat & Seafood,,,,Freezer,48,Case,EA,84,28,[],,
191,4260381820,219453,Grilled Chicken Breast Skewer,,"<p>Chicken, Breast, Skewer, Grilled, 30 Ct Package</p>","<p>Chicken, Breast, Skewer, Grilled, 30 Ct Package</p>",426038,0,https://gfsstore.com/products/426038/,https://gfsstore.com/products/426038/,[],,,"<p>Chicken, Breast, Skewer, Grilled, 30 Ct Package</p>","['4260380', '426038']",4260380|426038,182,Grilled Chicken Breast Skewer,Expresco,Expresco,expresco,"Chicken, Breast, Skewer, Grilled, 30 Ct Package","Grilled Chicken Breast Skewer Expresco Frozen Meat & Seafood Chicken, Breast, Skewer, Grilled, 30 Ct Package",41.99,,"['400042603809', '621588317122']",COOKED CHICKEN BREASTS,Frozen Meat & Seafood,Meat & Seafood,,,,Freezer,30,Case,EA,32,28,[],,
192,3542271820,204556,"Southern Style Breaded Chicken Tenderloins, FC",,"<p>Chicken, Tenderloins, Breaded, Southern Style, Fully Cooked, 40 Oz Bag</p>","<p>Chicken, Tenderloins, Breaded, Southern Style, Fully Cooked, 40 Oz Bag</p>",354227,0,https://gfsstore.com/products/354227/,https://gfsstore.com/products/354227/,[],,,"<p>Chicken, Tenderloins, Breaded, Southern Style, Fully Cooked, 40 Oz Bag</p>","['3542271', '354227']",3542271|354227,182,"Southern Style Breaded Chicken Tenderloins, FC",Tyson,Tyson,tyson,"Chicken, Tenderloins, Breaded, Southern Style, Fully Cooked, 40 Oz Bag","Southern Style Breaded Chicken Tenderloins, FC Tyson Frozen Meat & Seafood Chicken, Tenderloins, Breaded, Southern Style, Fully Cooked, 40 Oz Bag",16.49,,"['023700026866', '400035422714']",CHICKEN TENDERLOINS,Frozen Meat & Seafood,Meat & Seafood,,,,Freezer,40,OZ,Bag,103,27,[],,
193,3720691820,210674,"Bacon, Egg, & Cheese Croissant",,"<p>Breakfast, Croissant, Bacon, Egg, &#038; Cheese, 8 Ct Box</p>","<p>Breakfast, Croissant, Bacon, Egg, & Cheese, 8 Ct Box</p>",372069,0,https://gfsstore.com/products/372069/,https://gfsstore.com/products/372069/,[],,,"<p>Breakfast, Croissant, Bacon, Egg, & Cheese, 8 Ct Box</p>","['3720691', '372069']",3720691|372069,182,"Bacon, Egg, & Cheese Croissant",Jimmy Dean,Jimmy Dean,jimmy dean,"Breakfast, Croissant, Bacon, Egg, & Cheese, 8 Ct Box","Bacon, Egg, & Cheese Croissant Jimmy Dean Frozen Meat & Seafood Breakfast, Croissant, Bacon, Egg, & Cheese, 8 Ct Box",12.99,10.99,"['077900501869', '400037206916']",WRAP SANDWICHES & ENTREES,Frozen Meat & Seafood,Meat & Seafood,,1,,Freezer,8,EA,Box,48,27,[],,
194,5410601820,81155,Thick Cut Bacon,,"<p>Bacon, Shingle, Thick Cut, 16 Oz Package</p>","<p>Bacon, Shingle, Thick Cut, 16 Oz Package</p>",541060,0,https://gfsstore.com/products/541060/,https://gfsstore.com/products/541060/,[],,,"<p>Bacon, Shingle, Thick Cut, 16 Oz Package</p>","['5410601', '541060']",5410601|541060,182,Thick Cut Bacon,Smithfield,Smithfield,smithfield,"Bacon, Shingle, Thick Cut, 16 Oz Package","Thick Cut Bacon Smithfield Bacon & Breakfast Sausage Bacon, Shingle, Thick Cut, 16 Oz Package",7.99,6.99,"['070800041251', '070800041527', '400054106015']",NAT'L BRAND BACON,Bacon & Breakfast Sausage,Meat & Seafood,,1,,Cooler,16,OZ,Package,121,26,[],,
195,3794261820,211529,Breaded Fish Fillets,,"<p>Fish, Breaded, Fillets, 51 Oz Package</p>","<p>Fish, Breaded, Fillets, 51 Oz Package</p>",379426,0,https://gfsstore.com/products/379426/,https://gfsstore.com/products/379426/,[],,,"<p>Fish, Breaded, Fillets, 51 Oz Package</p>","['3794261', '379426']",3794261|379426,182,Breaded Fish Fillets,Gorton's,Gorton's,gorton's,"Fish, Breaded, Fillets, 51 Oz Package","Breaded Fish Fillets Gorton's Frozen Meat & Seafood Fish, Breaded, Fillets, 51 Oz Package",15.99,,"['044400191005', '400037942616']",POLLOCK FILLETS,Frozen Meat & Seafood,Meat & Seafood,,,,Freezer,51,OZ,Package,103,26,[],,
196,8348411820,59068,Wings That Wow,,"<p>Chicken Wings, Bone-In, Breaded, Cooked, Frozen, 5 Lb Bag</p>","<p>Chicken Wings, Bone-In, Breaded, Cooked, Frozen, 5 Lb Bag</p>",834841,0,https://gfsstore.com/products/834841/,https://gfsstore.com/products/834841/,[],,,"<p>Chicken Wings, Bone-In, Breaded, Cooked, Frozen, 5 Lb Bag</p>","['8348411', '8348410', '834841']",8348411|8348410|834841,182,Wings That Wow,Gordon Choice,Gordon Choice,gordon choice,"Chicken Wings, Bone-In, Breaded, Cooked, Frozen, 5 Lb Bag","Wings That Wow Gordon Choice Frozen Meat & Seafood Chicken Wings, Bone-In, Breaded, Cooked, Frozen, 5 Lb Bag",24.99,,['093901834843'],COOKED CHICKEN WINGS,Frozen Meat & Seafood,Meat & Seafood,,,,Freezer,80,OZ,Bag,24,26,[],,
197,3191921820,186152,Homestyle Meatballs,,"<p>Meatballs, Cooked, Homestyle, 28 Oz Each</p>","<p>Meatballs, Cooked, Homestyle, 28 Oz Each</p>",319192,0,https://gfsstore.com/products/319192/,https://gfsstore.com/products/319192/,[],,,"<p>Meatballs, Cooked, Homestyle, 28 Oz Each</p>","['3191921', '319192']",3191921|319192,182,Homestyle Meatballs,Cooked Perfect,Cooked Perfect,cooked perfect,"Meatballs, Cooked, Homestyle, 28 Oz Each","Homestyle Meatballs Cooked Perfect Frozen Meat & Seafood Meatballs, Cooked, Homestyle, 28 Oz Each",8.99,,"['036669028567', '400031919218']",MEATBALLS,Frozen Meat & Seafood,Meat & Seafood,,,,Freezer,28,OZ,Each,200,25,[],,
198,8168001820,109934,Turkey Bacon,,"<p>Turkey Bacon, Smoked Cured Turkey, No MSG, No Fillers, 60% Less Fat, 12 Oz Package</p>","<p>Turkey Bacon, Smoked Cured Turkey, No MSG, No Fillers, 60% Less Fat, 12 Oz Package</p>",816800,0,https://admin.gfsstore.com/?post_type=product&#038;p=109934,https://admin.gfsstore.com/?post_type=product&#038;p=109934,,,,"<p>Turkey Bacon, Smoked Cured Turkey, No MSG, No Fillers, 60% Less Fat, 12 Oz Package</p>","['8168001', '816800']",8168001|816800,182,Turkey Bacon,Butterball,Butterball,butterball,"Turkey Bacon, Smoked Cured Turkey, No MSG, No Fillers, 60% Less Fat, 12 Oz Package","Turkey Bacon Butterball Bacon & Breakfast Sausage Turkey Bacon, Smoked Cured Turkey, No MSG, No Fillers, 60% Less Fat, 12 Oz Package",4.79,,"['022655303015', '400081680014']",NAT'L BRAND BACON,Bacon & Breakfast Sausage,Meat & Seafood,,,,Cooler,12,OZ,Package,121,25,[],,"[{'term_id': 408, 'slug': 'butterball', 'name': 'Butterball', 'parent': 0, 'term_taxonomy_id': 408}]"
199,3076611820,44003,Smoked Sausage,,"<p>Sausage, Smoked Beef &#038; Pork, 6-3/4 Inch, Links, 4 Count Per Pound, Cooked, Frozen, 5 Lb Bag, 2 Per Case</p>","<p>Sausage, Smoked Beef & Pork, 6-3/4 Inch, Links, 4 Count Per Pound, Cooked, Frozen, 5 Lb Bag, 2 Per Case</p>",307661,0,https://gfsstore.com/products/307661/,https://gfsstore.com/products/307661/,[],,,"<p>Sausage, Smoked Beef & Pork, 6-3/4 Inch, Links, 4 Count Per Pound, Cooked, Frozen, 5 Lb Bag, 2 Per Case</p>","['3076610', '307661']",3076610|307661,182,Smoked Sausage,Gordon Choice,Gordon Choice,gordon choice,"Sausage, Smoked Beef & Pork, 6-3/4 Inch, Links, 4 Count Per Pound, Cooked, Frozen, 5 Lb Bag, 2 Per Case","Smoked Sausage Gordon Choice Bratwurst, Sausage, Hot Dogs & Franks Sausage, Smoked Beef & Pork, 6-3/4 Inch, Links, 4 Count Per Pound, Cooked, Frozen, 5 Lb Bag, 2 Per Case",36.99,,"['093901307668', '10093901307665', '400030766103']",GFS SPECIALTY SAUSAGES,"Bratwurst, Sausage, Hot Dogs & Franks",Meat & Seafood,,,,Freezer,40,Case,EA,67,25,[],,
200,3541171820,204552,Breaded Chicken Nuggets,,"<p>Chicken, Nuggets, Breaded, Fully Cooked, 32 Oz Bag</p>","<p>Chicken, Nuggets, Breaded, Fully Cooked, 32 Oz Bag</p>",354117,0,https://gfsstore.com/products/354117/,https://gfsstore.com/products/354117/,[],,,"<p>Chicken, Nuggets, Breaded, Fully Cooked, 32 Oz Bag</p>","['3541171', '354117']",3541171|354117,182,Breaded Chicken Nuggets,Tyson,Tyson,tyson,"Chicken, Nuggets, Breaded, Fully Cooked, 32 Oz Bag","Breaded Chicken Nuggets Tyson Frozen Meat & Seafood Chicken, Nuggets, Breaded, Fully Cooked, 32 Oz Bag",7.49,5.99,"['023700028471', '400035411718']",CHICKEN NUGGETS FORMED,Frozen Meat & Seafood,Meat & Seafood,,1,,Freezer,32,OZ,Bag,50,25,[],,
201,2913701820,16217,Smoked Round Boneless Ham,,"<p>Hams, Water-Added 6.5 Inch Round, Smoked, 12 Pound Average, Fresh, 192 Oz Piece</p>","<p>Hams, Water-Added 6.5 Inch Round, Smoked, 12 Pound Average, Fresh, 192 Oz Piece</p>",291370,0,https://gfsstore.com/products/291370/,https://gfsstore.com/products/291370/,,,,"<p>Hams, Water-Added 6.5 Inch Round, Smoked, 12 Pound Average, Fresh, 192 Oz Piece</p>","['2913701', '291370']",2913701|291370,182,Smoked Round Boneless Ham,Gordon Choice,Gordon Choice,gordon choice,"Hams, Water-Added 6.5 Inch Round, Smoked, 12 Pound Average, Fresh, 192 Oz Piece","Smoked Round Boneless Ham Gordon Choice Pork Hams, Water-Added 6.5 Inch Round, Smoked, 12 Pound Average, Fresh, 192 Oz Piece",3.99,,['093901291370'],GFS SMOKED & CURED HAMS,Pork,Meat & Seafood,,,,Cooler,192,OZ,Piece,1,25,[],,"[{'term_id': 343, 'slug': 'gordon-choice', 'name': 'Gordon Choice', 'parent': 0, 'term_taxonomy_id': 343}]"
202,1007001820,15653,Fully Cooked Ground Chuck Beef Pub Burger Patties,,"<p>Beef Pub Burger Patties, Ground Chuck, Flame-Broiled, USDA Choice, 4 Ounce, Cooked, IQF, 4 Oz Each</p>","<p>Beef Pub Burger Patties, Ground Chuck, Flame-Broiled, USDA Choice, 4 Ounce, Cooked, IQF, 4 Oz Each</p>",100700,0,https://gfsstore.com/products/100700/,https://gfsstore.com/products/100700/,,,,"<p>Beef Pub Burger Patties, Ground Chuck, Flame-Broiled, USDA Choice, 4 Ounce, Cooked, IQF, 4 Oz Each</p>","['1007000', '100700']",1007000|100700,182,Fully Cooked Ground Chuck Beef Pub Burger Patties,Gordon Choice,Gordon Choice,gordon choice,"Beef Pub Burger Patties, Ground Chuck, Flame-Broiled, USDA Choice, 4 Ounce, Cooked, IQF, 4 Oz Each, 48 Per Case","Fully Cooked Ground Chuck Beef Pub Burger Patties Gordon Choice Frozen Meat & Seafood Beef Pub Burger Patties, Ground Chuck, Flame-Broiled, USDA Choice, 4 Ounce, Cooked, IQF, 4 Oz Each, 48 Per Case",116.99,,"['093901100702', '400010070008']",COOKED BEEF PATTIES & MEATLOAF,Frozen Meat & Seafood,Meat & Seafood,,,,Freezer,48,Case,EA,79,24,[],,"[{'term_id': 43, 'slug': 'gfs', 'name': 'GFS', 'parent': 0, 'term_taxonomy_id': 43}]"
203,4516831820,113035,Lump Crabmeat,,"<p>Crab Meat, Lump, Frozen, 1 Lb Bag</p>","<p>Crab Meat, Lump, Frozen, 1 Lb Bag</p>",451683,0,https://admin.gfsstore.com/products/451683/,https://admin.gfsstore.com/products/451683/,[],,,"<p>Crab Meat, Lump, Frozen, 1 Lb Bag</p>","['4516831', '451683']",4516831|451683,182,Lump Crabmeat,Jack's Catch,Jack's Catch,jack's catch,"Crab Meat, Lump, Frozen, 1 Lb Bag","Lump Crabmeat Jack's Catch Frozen Meat & Seafood Crab Meat, Lump, Frozen, 1 Lb Bag",14.49,,"['400045168312', '683983326208']",CRAB & LOBSTER MEAT/CAKES,Frozen Meat & Seafood,Meat & Seafood,,,,Freezer,16,OZ,Bag,44,24,[],,
